{
  "game": {
    "generationId": 3,
    "id": "firered",
    "name": "Pokémon FireRed",
    "regionId": 1,
    "versionGroupId": 7,
    "versionId": 10
  },
  "nodes": [
    {
      "branch": "main",
      "events": [
        {
          "conditions": [],
          "description": "Select Bulbasaur, Charmander, or Squirtle to begin the journey.",
          "flags": {
            "bossFight": false,
            "gym": false,
            "keyMilestone": false,
            "optional": false,
            "rivalFight": false,
            "storyFight": false
          },
          "id": "starter-selection",
          "name": "Choose a starter from Professor Oak",
          "order": 0,
          "provenance": [
            {
              "confidence": "verified",
              "locator": "Walkthrough Part 1: Pallet Town",
              "method": "manual",
              "note": null,
              "sourceId": "bulbapedia-frlg-walkthrough"
            }
          ],
          "type": "choice",
          "unlocks": [],
          "versionFlags": {
            "firered": {
              "available": true,
              "exclusive": false
            }
          }
        }
      ],
      "goldenPathOrder": 0,
      "id": "pallet-town",
      "kind": "town",
      "location": {
        "pokeApiLocationAreaIds": [
          285
        ],
        "pokeApiLocationId": 86,
        "sourceMapIds": [
          "pallet-town"
        ]
      },
      "name": "Pallet Town",
      "nextNodeIds": [
        "kanto-route-1"
      ],
      "parentNodeId": null,
      "phase": "kanto-opening",
      "prerequisiteEventIds": [],
      "provenance": [
        {
          "confidence": "verified",
          "locator": "location/86",
          "method": "generated",
          "note": "FireRed encounter areas bound from the pinned PokeAPI snapshot.",
          "sourceId": "pokeapi-api-data"
        },
        {
          "confidence": "cross-checked",
          "locator": "Walkthrough Part 1: Pallet Town",
          "method": "manual",
          "note": null,
          "sourceId": "bulbapedia-frlg-walkthrough"
        },
        {
          "confidence": "cross-checked",
          "locator": "data/maps (map connectivity for Pallet Town)",
          "method": "inferred",
          "note": "Reference only; pret source not redistributed.",
          "sourceId": "pret-pokefirered"
        }
      ],
      "versionFlags": {
        "firered": {
          "available": true,
          "exclusive": false
        }
      }
    },
    {
      "branch": "main",
      "events": [],
      "goldenPathOrder": 1,
      "id": "kanto-route-1",
      "kind": "route",
      "location": {
        "pokeApiLocationAreaIds": [
          295
        ],
        "pokeApiLocationId": 88,
        "sourceMapIds": [
          "kanto-route-1"
        ]
      },
      "name": "Route 1",
      "nextNodeIds": [
        "viridian-city"
      ],
      "parentNodeId": null,
      "phase": "kanto-opening",
      "prerequisiteEventIds": [],
      "provenance": [
        {
          "confidence": "verified",
          "locator": "location/88",
          "method": "generated",
          "note": "FireRed encounter areas bound from the pinned PokeAPI snapshot.",
          "sourceId": "pokeapi-api-data"
        },
        {
          "confidence": "cross-checked",
          "locator": "Walkthrough Part 2: Route 1",
          "method": "manual",
          "note": null,
          "sourceId": "bulbapedia-frlg-walkthrough"
        }
      ],
      "versionFlags": {
        "firered": {
          "available": true,
          "exclusive": false
        }
      }
    },
    {
      "branch": "main",
      "events": [
        {
          "conditions": [],
          "description": "Return the parcel to Professor Oak to receive the Pokédex.",
          "flags": {
            "bossFight": false,
            "gym": false,
            "keyMilestone": false,
            "optional": false,
            "rivalFight": false,
            "storyFight": false
          },
          "id": "viridian-oaks-parcel",
          "name": "Deliver Oak's Parcel",
          "order": 0,
          "provenance": [
            {
              "confidence": "verified",
              "locator": "Walkthrough Part 2: Viridian City",
              "method": "manual",
              "note": null,
              "sourceId": "bulbapedia-frlg-walkthrough"
            }
          ],
          "type": "story",
          "unlocks": [],
          "versionFlags": {
            "firered": {
              "available": true,
              "exclusive": false
            }
          }
        },
        {
          "conditions": [
            {
              "kind": "milestone-complete",
              "note": null,
              "operator": "equals",
              "value": "blaine-gym"
            }
          ],
          "description": "The eighth Gym, opened only after the other seven badges are earned.",
          "flags": {
            "bossFight": true,
            "gym": true,
            "keyMilestone": true,
            "optional": false,
            "rivalFight": false,
            "storyFight": false
          },
          "id": "giovanni-gym",
          "name": "Viridian Gym — Giovanni (Earth Badge)",
          "order": 1,
          "provenance": [
            {
              "confidence": "verified",
              "locator": "Walkthrough Part 15: Viridian Gym",
              "method": "manual",
              "note": null,
              "sourceId": "bulbapedia-frlg-walkthrough"
            }
          ],
          "type": "gym",
          "unlocks": [
            {
              "kind": "service",
              "note": "Enables Route 22/23 access to Victory Road.",
              "refId": "earth-badge"
            }
          ],
          "versionFlags": {
            "firered": {
              "available": true,
              "exclusive": false
            }
          }
        }
      ],
      "goldenPathOrder": 2,
      "id": "viridian-city",
      "kind": "city",
      "location": {
        "pokeApiLocationAreaIds": [
          280
        ],
        "pokeApiLocationId": 154,
        "sourceMapIds": [
          "viridian-city"
        ]
      },
      "name": "Viridian City",
      "nextNodeIds": [
        "kanto-route-22"
      ],
      "parentNodeId": null,
      "phase": "kanto-opening",
      "prerequisiteEventIds": [],
      "provenance": [
        {
          "confidence": "verified",
          "locator": "location/154",
          "method": "generated",
          "note": "FireRed encounter areas bound from the pinned PokeAPI snapshot.",
          "sourceId": "pokeapi-api-data"
        },
        {
          "confidence": "cross-checked",
          "locator": "Walkthrough Part 2: Viridian City",
          "method": "manual",
          "note": null,
          "sourceId": "bulbapedia-frlg-walkthrough"
        }
      ],
      "versionFlags": {
        "firered": {
          "available": true,
          "exclusive": false
        }
      }
    },
    {
      "branch": "optional",
      "events": [
        {
          "conditions": [],
          "description": "A rival battle available west of Viridian City before challenging Brock.",
          "flags": {
            "bossFight": false,
            "gym": false,
            "keyMilestone": false,
            "optional": true,
            "rivalFight": true,
            "storyFight": false
          },
          "id": "route-22-rival-early",
          "name": "Optional early Rival battle",
          "order": 0,
          "provenance": [
            {
              "confidence": "cross-checked",
              "locator": "Walkthrough Part 2: Route 22",
              "method": "manual",
              "note": null,
              "sourceId": "bulbapedia-frlg-walkthrough"
            }
          ],
          "type": "rival",
          "unlocks": [],
          "versionFlags": {
            "firered": {
              "available": true,
              "exclusive": false
            }
          }
        },
        {
          "conditions": [
            {
              "kind": "milestone-complete",
              "note": null,
              "operator": "equals",
              "value": "giovanni-gym"
            }
          ],
          "description": "The later Route 22 traversal to Route 23 opens once all eight badges are earned.",
          "flags": {
            "bossFight": false,
            "gym": false,
            "keyMilestone": false,
            "optional": false,
            "rivalFight": false,
            "storyFight": false
          },
          "id": "route-22-victory-road-access",
          "name": "Return through Route 22 toward Victory Road",
          "order": 1,
          "provenance": [
            {
              "confidence": "cross-checked",
              "locator": "Walkthrough Part 16: Route 22",
              "method": "manual",
              "note": null,
              "sourceId": "bulbapedia-frlg-walkthrough"
            }
          ],
          "type": "checkpoint",
          "unlocks": [],
          "versionFlags": {
            "firered": {
              "available": true,
              "exclusive": false
            }
          }
        }
      ],
      "goldenPathOrder": 3,
      "id": "kanto-route-22",
      "kind": "route",
      "location": {
        "pokeApiLocationAreaIds": [
          313
        ],
        "pokeApiLocationId": 102,
        "sourceMapIds": [
          "kanto-route-22"
        ]
      },
      "name": "Route 22",
      "nextNodeIds": [
        "kanto-route-2"
      ],
      "parentNodeId": null,
      "phase": "kanto-opening",
      "prerequisiteEventIds": [],
      "provenance": [
        {
          "confidence": "verified",
          "locator": "location/102",
          "method": "generated",
          "note": "FireRed encounter areas bound from the pinned PokeAPI snapshot.",
          "sourceId": "pokeapi-api-data"
        },